{
  "ledger_id": "led-redacted-remote_resilient_microgrid-001",
  "spec_version": "1.0.0",
  "subject": {
    "kind": "Deployment",
    "id": "dep-redacted-remote-microgrid-001",
    "label": "REDACTED remote resilient microgrid worked example"
  },
  "created_at": "2026-07-20T21:00:00Z",
  "baseline_id": "KEEL-SPEC-BASELINE-2026.07.20",
  "machine_definition_id": "oidf.equipment.canonical@1.0.0",
  "entries": [
    {
      "seq": 1,
      "occurred_at": "2026-07-20T21:05:00Z",
      "from_state": "ReadyForCommission",
      "to_state": "Commissioned",
      "actor_id": "actor-redacted-commissioning-runtime",
      "evidence_refs": [
        "ev-redacted-001",
        "ev-redacted-002",
        "ev-redacted-003"
      ],
      "sat_event_ids": [
        "sat-redacted-diesel-baseline-001",
        "sat-redacted-inverter-join-001",
        "sat-redacted-hybrid-handoff-001",
        "sat-redacted-ddil-001",
        "sat-redacted-owner-handoff-export-001"
      ],
      "notes": "Redacted worked example; source telemetry and site identifiers removed."
    }
  ]
}
