{
  "ledger_id": "led-redacted-ev_fleet_btm-001",
  "spec_version": "1.0.0",
  "subject": {
    "kind": "Deployment",
    "id": "dep-redacted-ev-fleet-btm-001",
    "label": "REDACTED EV depot BTM worked example"
  },
  "created_at": "2026-07-20T21:00:00Z",
  "baseline_id": "KEEL-SPEC-BASELINE-2026.07.20",
  "machine_definition_id": "oidf.equipment.canonical@1.0.0",
  "entries": [
    {
      "seq": 1,
      "occurred_at": "2026-07-20T21:05:00Z",
      "from_state": "ReadyForCommission",
      "to_state": "Commissioned",
      "actor_id": "actor-redacted-commissioning-runtime",
      "evidence_refs": [
        "ev-redacted-clearance-labeling-001",
        "ev-redacted-grounding-ir-001",
        "ev-redacted-cell-voltage-001",
        "ev-redacted-bess-ir-001",
        "ev-redacted-bess-thermal-001",
        "ev-redacted-charger-comms-001",
        "ev-redacted-estop-trip-001",
        "ev-redacted-integrated-thermal-001",
        "ev-redacted-charger-load-step-001"
      ],
      "sat_event_ids": [
        "sat-redacted-install-clearance-001",
        "sat-redacted-grounding-bonding-001",
        "sat-redacted-bess-precommission-001",
        "sat-redacted-bess-insulation-001",
        "sat-redacted-bess-thermal-001",
        "sat-redacted-charger-loop-001",
        "sat-redacted-estop-trip-001",
        "sat-redacted-integrated-run-001",
        "sat-redacted-charger-load-step-001"
      ],
      "notes": "Redacted worked example; evidence_refs align to SAT event metrics and source telemetry/site identifiers are removed."
    }
  ]
}
