{
  "ledger_id": "led-redacted-hyperscale_island-001",
  "spec_version": "1.0.0",
  "subject": {
    "kind": "Deployment",
    "id": "dep-redacted-hyperscale-island-001",
    "label": "REDACTED hyperscale island worked example"
  },
  "created_at": "2026-07-20T21:00:00Z",
  "baseline_id": "KEEL-SPEC-BASELINE-2026.07.20",
  "machine_definition_id": "oidf.equipment.canonical@1.0.0",
  "entries": [
    {
      "seq": 1,
      "occurred_at": "2026-07-20T21:05:00Z",
      "from_state": "ReadyForCommission",
      "to_state": "Commissioned",
      "actor_id": "actor-redacted-commissioning-runtime",
      "evidence_refs": [
        "ev-redacted-fc-interlocks-001",
        "ev-redacted-gas-detection-loop-001",
        "ev-redacted-phase-sync-001",
        "ev-redacted-island-transfer-sequence-001",
        "ev-redacted-island-voltage-001",
        "ev-redacted-ups-ridethrough-001",
        "ev-redacted-resync-return-001",
        "ev-redacted-return-sync-001"
      ],
      "sat_event_ids": [
        "sat-redacted-fc-string-001",
        "sat-redacted-gas-detection-001",
        "sat-redacted-phase-sync-001",
        "sat-redacted-island-xfer-001",
        "sat-redacted-island-voltage-001",
        "sat-redacted-ups-ridethrough-001",
        "sat-redacted-resync-return-001",
        "sat-redacted-return-sync-001"
      ],
      "notes": "Redacted worked example; evidence_refs align to SAT event metrics and source telemetry/site identifiers are removed."
    }
  ]
}
